{
  "schema": 1,
  "id": "nemotron-super-vl-exl3-3.5bpw",
  "name": "Nemotron 3.5 Super VL 120B A12B EXL3 3.5bpw HQ",
  "base_model": "nemotron-3.5-super-vl-120b-a12b",
  "finetune_of": null,
  "author": {
    "github": "styles01",
    "social": {
      "huggingface": "aitamedia"
    }
  },
  "hf": {
    "repo": "aitamedia/NVIDIA-Nemotron-3.5-Super-VL-120B-A12B-EXL3-3.5bpw",
    "revision": "358667cf420fc2869dff43d9ff64bafe31aef03b"
  },
  "format": "exl3",
  "bpw": 3.58,
  "size_gb": 57.8,
  "load": "standalone",
  "modalities": {
    "text": true,
    "image": false,
    "audio": false,
    "video": false
  },
  "modalities_in_pack": [
    "text",
    "image"
  ],
  "drafters": "none",
  "license": "OpenMDW-1.1",
  "license_url": "https://openmdw.ai/license/1-1/",
  "description": "TensorFold/exllamav3 EXL3 HQ quantization of NVIDIA's Nemotron 3.5 Super VL 120B A12B (88-layer hybrid mamba-attention-MoE with MTP; text arch remapped from the omni checkpoint). Encoded -b 3.5 --hq (3.5bpw experts, 5bpw attention+dense, 16bpw head and embeddings). The pack also holds the fp16 vision tower; TandemLLM serves it as text only for now (ENG-271).",
  "tags": [
    "exl3",
    "hybrid-mamba",
    "mtp",
    "120b-a12b",
    "dgx-spark"
  ],
  "added": "2026-10-17",
  "status": "submitted"
}
